==192596== Memcheck, a memory error detector
==192596== Copyright (C) 2002-2017, and GNU GPL'd, by Julian Seward et al.
==192596== Using Valgrind-3.18.1 and LibVEX; rerun with -h for copyright info
==192596== Command: ./bfTester -c 2
==192596== 
[1mError[0m in ./semantic_tests/test_ERR_INV_EXP_02.lang[36m:1:11[0m
  [31minvalid expression[0m

[36m    1 | [0m(x + y) = 10;
      |           [1m[31m^^[0m

[1mError[0m in ./semantic_tests/test_ERR_UNEXP_CHAR_01.lang[36m:1:11[0m
  [31munexpected character[0m

[36m    1 | [0mvar x = 5 @ 3;
      |           [1m[31m^[0m

[1mError[0m in ./semantic_tests/test_ERR_INV_EXP_01.lang[36m:1:5[0m
  [31minvalid expression[0m

[36m    1 | [0m5 = x;
      |     [1m[31m^[0m

==192596== Invalid read of size 8
==192596==    at 0x110CB7: check_stmt_semantics (semantics.c:319)
==192596==    by 0x110E33: check_stmt_semantics (semantics.c:340)
==192596==    by 0x110EB7: check_file_semantics (semantics.c:352)
==192596==    by 0x10F3FC: test_error (test.c:386)
==192596==    by 0x10FA6E: run_error_tests (test.c:481)
==192596==    by 0x10A647: main (runTests.c:16)
==192596==  Address 0x4aa02e0 is 16 bytes inside a block of size 32 free'd
==192596==    at 0x484B27F: free (in /usr/libexec/valgrind/vgpreload_memcheck-amd64-linux.so)
==192596==    by 0x11200E: free_stmt (stmt.c:68)
==192596==    by 0x111FF6: free_stmt (stmt.c:65)
==192596==    by 0x10FD5A: free_env (semantics.c:59)
==192596==    by 0x10FD14: free_env (semantics.c:52)
==192596==    by 0x110CAF: check_stmt_semantics (semantics.c:317)
==192596==    by 0x110E33: check_stmt_semantics (semantics.c:340)
==192596==    by 0x110EB7: check_file_semantics (semantics.c:352)
==192596==    by 0x10F3FC: test_error (test.c:386)
==192596==    by 0x10FA6E: run_error_tests (test.c:481)
==192596==    by 0x10A647: main (runTests.c:16)
==192596==  Block was alloc'd at
==192596==    at 0x484DA83: calloc (in /usr/libexec/valgrind/vgpreload_memcheck-amd64-linux.so)
==192596==    by 0x11226A: init_stmt (stmt.c:119)
==192596==    by 0x10C585: parse_stmt (parser.c:526)
==192596==    by 0x10C628: parse_file (parser.c:537)
==192596==    by 0x110E77: check_file_semantics (semantics.c:344)
==192596==    by 0x10F3FC: test_error (test.c:386)
==192596==    by 0x10FA6E: run_error_tests (test.c:481)
==192596==    by 0x10A647: main (runTests.c:16)
==192596== 
==192596== Invalid read of size 8
==192596==    at 0x110CBB: check_stmt_semantics (semantics.c:319)
==192596==    by 0x110E33: check_stmt_semantics (semantics.c:340)
==192596==    by 0x110EB7: check_file_semantics (semantics.c:352)
==192596==    by 0x10F3FC: test_error (test.c:386)
==192596==    by 0x10FA6E: run_error_tests (test.c:481)
==192596==    by 0x10A647: main (runTests.c:16)
==192596==  Address 0x10 is not stack'd, malloc'd or (recently) free'd
==192596== 
==192596== 
==192596== Process terminating with default action of signal 11 (SIGSEGV)
==192596==  Access not within mapped region at address 0x10
==192596==    at 0x110CBB: check_stmt_semantics (semantics.c:319)
==192596==    by 0x110E33: check_stmt_semantics (semantics.c:340)
==192596==    by 0x110EB7: check_file_semantics (semantics.c:352)
==192596==    by 0x10F3FC: test_error (test.c:386)
==192596==    by 0x10FA6E: run_error_tests (test.c:481)
==192596==    by 0x10A647: main (runTests.c:16)
==192596==  If you believe this happened as a result of a stack
==192596==  overflow in your program's main thread (unlikely but
==192596==  possible), you can try to increase the size of the
==192596==  main thread stack using the --main-stacksize= flag.
==192596==  The main thread stack size used in this run was 8388608.
==192596== 
==192596== HEAP SUMMARY:
==192596==     in use at exit: 37,036 bytes in 9 blocks
==192596==   total heap usage: 162 allocs, 153 frees, 70,230 bytes allocated
==192596== 
==192596== 124 (48 direct, 76 indirect) bytes in 2 blocks are definitely lost in loss record 6 of 8
==192596==    at 0x484DA83: calloc (in /usr/libexec/valgrind/vgpreload_memcheck-amd64-linux.so)
==192596==    by 0x111516: init_exp (exp.c:150)
==192596==    by 0x10BB55: parse_exp (parser.c:338)
==192596==    by 0x10C511: parse_single_stmt (parser.c:515)
==192596==    by 0x10C55D: parse_stmt (parser.c:522)
==192596==    by 0x10C628: parse_file (parser.c:537)
==192596==    by 0x110E77: check_file_semantics (semantics.c:344)
==192596==    by 0x10F3FC: test_error (test.c:386)
==192596==    by 0x10FA6E: run_error_tests (test.c:481)
==192596==    by 0x10A647: main (runTests.c:16)
==192596== 
==192596== LEAK SUMMARY:
==192596==    definitely lost: 48 bytes in 2 blocks
==192596==    indirectly lost: 76 bytes in 5 blocks
==192596==      possibly lost: 0 bytes in 0 blocks
==192596==    still reachable: 36,912 bytes in 2 blocks
==192596==         suppressed: 0 bytes in 0 blocks
==192596== Reachable blocks (those to which a pointer was found) are not shown.
==192596== To see them, rerun with: --leak-check=full --show-leak-kinds=all
==192596== 
==192596== For lists of detected and suppressed errors, rerun with: -s
==192596== ERROR SUMMARY: 3 errors from 3 contexts (suppressed: 0 from 0)
